adult,backdrop_path,belongs_to_collection,budget,genres,homepage,id,imdb_id,original_language,original_title,overview,popularity,poster_path,production_companies,production_countries,release_date,revenue,runtime,spoken_languages,status,tagline,title,video,vote_average,vote_count
False,/jlQJDD0L5ZojjlS0KYnApdO0n19.jpg,"{'id': 87096, 'name': 'Avatar Collection', 'poster_path': '/gC3tW9a45RGOzzSh6wv91pFnmFr.jpg', 'backdrop_path': '/syGPZuzcHBBHMLiNDN0x0Tms4Fk.jpg'}",237000000,"[{'id': 28, 'name': 'Action'}, {'id': 12, 'name': 'Adventure'}, {'id': 14, 'name': 'Fantasy'}, {'id': 878, 'name': 'Science Fiction'}]",http://www.avatarmovie.com/,19995,tt0499549,en,Avatar,"In the 22nd century, a paraplegic Marine is dispatched to the moon Pandora on a unique mission, but becomes torn between following orders and protecting an alien civilization.",347.168,/jRXYjXNq0Cs2TcJjLkki24MLp7u.jpg,"[{'id': 444, 'logo_path': '/42UPdZl6B2cFXgNUASR8hSt9mpS.png', 'name': 'Dune Entertainment', 'origin_country': 'US'}, {'id': 574, 'logo_path': '/iB6GjNVHs5hOqcEYt2rcjBqIjki.png', 'name': 'Lightstorm Entertainment', 'origin_country': 'US'}, {'id': 25, 'logo_path': '/qZCc1lty5FzX30aOCVRBLzaVmcp.png', 'name': '20th Century Fox', 'origin_country': 'US'}, {'id': 290, 'logo_path': '/Q8mw2AOQQc8Qg0uNwLWq86DVZv.png', 'name': 'Ingenious Media', 'origin_country': 'GB'}]","[{'iso_3166_1': 'US', 'name': 'United States of America'}, {'iso_3166_1': 'GB', 'name': 'United Kingdom'}]",2009-12-10,2847246203,162,"[{'english_name': 'English', 'iso_639_1': 'en', 'name': 'English'}, {'english_name': 'Spanish', 'iso_639_1': 'es', 'name': 'Español'}]",Released,Enter the World of Pandora.,Avatar,False,7.5,24384
False,/7RyHsO4yDXtBv1zUU3mTpHeQ0d5.jpg,"{'id': 86311, 'name': 'The Avengers Collection', 'poster_path': '/yFSIUVTCvgYrpalUktulvk3Gi5Y.jpg', 'backdrop_path': '/zuW6fOiusv4X9nnW3paHGfXcSll.jpg'}",356000000,"[{'id': 12, 'name': 'Adventure'}, {'id': 878, 'name': 'Science Fiction'}, {'id': 28, 'name': 'Action'}]",https://www.marvel.com/movies/avengers-endgame,299534,tt4154796,en,Avengers: Endgame,"After the devastating events of Avengers: Infinity War, the universe is in ruins due to the efforts of the Mad Titan, Thanos. With the help of remaining allies, the Avengers must assemble once more in order to undo Thanos' actions and restore order to the universe once and for all, no matter what consequences may be in store.",256.948,/or06FN3Dka5tukK1e9sl16pB3iy.jpg,"[{'id': 420, 'logo_path': '/hUzeosd33nzE5MCNsZxCGEKTXaQ.png', 'name': 'Marvel Studios', 'origin_country': 'US'}]","[{'iso_3166_1': 'US', 'name': 'United States of America'}]",2019-04-24,2797800564,181,"[{'english_name': 'English', 'iso_639_1': 'en', 'name': 'English'}, {'english_name': 'Japanese', 'iso_639_1': 'ja', 'name': '日本語'}, {'english_name': 'Xhosa', 'iso_639_1': 'xh', 'name': ''}]",Released,Part of the journey is the end.,Avengers: Endgame,False,8.3,19586
False,/6VmFqApQRyZZzmiGOQq2C92jyvH.jpg,,200000000,"[{'id': 18, 'name': 'Drama'}, {'id': 10749, 'name': 'Romance'}]",,597,tt0120338,en,Titanic,"101-year-old Rose DeWitt Bukater tells the story of her life aboard the Titanic, 84 years later. A young Rose boards the ship with her mother and fiancé. Meanwhile, Jack Dawson and Fabrizio De Rossi win third-class tickets aboard the ship. Rose tells the whole story from Titanic's departure through to its death—on its first and last voyage—on April 15, 1912.",98.032,/9xjZS2rlVxm8SFx8kPC3aIGCOYQ.jpg,"[{'id': 4, 'logo_path': '/fycMZt242LVjagMByZOLUGbCvv3.png', 'name': 'Paramount', 'origin_country': 'US'}, {'id': 25, 'logo_path': '/qZCc1lty5FzX30aOCVRBLzaVmcp.png', 'name': '20th Century Fox', 'origin_country': 'US'}, {'id': 574, 'logo_path': '/iB6GjNVHs5hOqcEYt2rcjBqIjki.png', 'name': 'Lightstorm Entertainment', 'origin_country': 'US'}]","[{'iso_3166_1': 'US', 'name': 'United States of America'}]",1997-11-18,2187463944,194,"[{'english_name': 'English', 'iso_639_1': 'en', 'name': 'English'}, {'english_name': 'French', 'iso_639_1': 'fr', 'name': 'Français'}, {'english_name': 'German', 'iso_639_1': 'de', 'name': 'Deutsch'}, {'english_name': 'Swedish', 'iso_639_1': 'sv', 'name': 'svenska'}, {'english_name': 'Italian', 'iso_639_1': 'it', 'name': 'Italiano'}, {'english_name': 'Russian', 'iso_639_1': 'ru', 'name': 'Pусский'}]",Released,Nothing on Earth could come between them.,Titanic,False,7.9,20107
False,/k6EOrckWFuz7I4z4wiRwz8zsj4H.jpg,"{'id': 10, 'name': 'Star Wars Collection', 'poster_path': '/tdQzRSk4PXX6hzjLcQWHafYtZTI.jpg', 'backdrop_path': '/d8duYyyC9J5T825Hg7grmaabfxQ.jpg'}",245000000,"[{'id': 28, 'name': 'Action'}, {'id': 12, 'name': 'Adventure'}, {'id': 878, 'name': 'Science Fiction'}, {'id': 14, 'name': 'Fantasy'}]",http://www.starwars.com/films/star-wars-episode-vii,140607,tt2488496,en,Star Wars: The Force Awakens,"Thirty years after defeating the Galactic Empire, Han Solo and his allies face a new threat from the evil Kylo Ren and his army of Stormtroopers.",65.258,/wqnLdwVXoBjKibFRR5U3y0aDUhs.jpg,"[{'id': 1, 'logo_path': '/o86DbpburjxrqAzEDhXZcyE8pDb.png', 'name': 'Lucasfilm Ltd.', 'origin_country': 'US'}, {'id': 11461, 'logo_path': '/p9FoEt5shEKRWRKVIlvFaEmRnun.png', 'name': 'Bad Robot', 'origin_country': 'US'}]","[{'iso_3166_1': 'US', 'name': 'United States of America'}]",2015-12-15,2068223624,136,"[{'english_name': 'English', 'iso_639_1': 'en', 'name': 'English'}]",Released,Every generation has a story.,Star Wars: The Force Awakens,False,7.3,16387
False,/lmZFxXgJE3vgrciwuDib0N8CfQo.jpg,"{'id': 86311, 'name': 'The Avengers Collection', 'poster_path': '/yFSIUVTCvgYrpalUktulvk3Gi5Y.jpg', 'backdrop_path': '/zuW6fOiusv4X9nnW3paHGfXcSll.jpg'}",300000000,"[{'id': 12, 'name': 'Adventure'}, {'id': 28, 'name': 'Action'}, {'id': 878, 'name': 'Science Fiction'}]",https://www.marvel.com/movies/avengers-infinity-war,299536,tt4154756,en,Avengers: Infinity War,"As the Avengers and their allies have continued to protect the world from threats too large for any one hero to handle, a new danger has emerged from the cosmic shadows: Thanos. A despot of intergalactic infamy, his goal is to collect all six Infinity Stones, artifacts of unimaginable power, and use them to inflict his twisted will on all of reality. Everything the Avengers have fought for has led up to this moment - the fate of Earth and existence itself has never been more uncertain.",373.65,/7WsyChQLEftFiDOVTGkv3hFpyyt.jpg,"[{'id': 420, 'logo_path': '/hUzeosd33nzE5MCNsZxCGEKTXaQ.png', 'name': 'Marvel Studios', 'origin_country': 'US'}]","[{'iso_3166_1': 'US', 'name': 'United States of America'}]",2018-04-25,2046239637,149,"[{'english_name': 'English', 'iso_639_1': 'en', 'name': 'English'}, {'english_name': 'Xhosa', 'iso_639_1': 'xh', 'name': ''}]",Released,An entire universe. Once and for all.,Avengers: Infinity War,False,8.3,23161
False,/yOCRqvrRrxbs5FYq2pX1KtLJwmR.jpg,"{'id': 328, 'name': 'Jurassic Park Collection', 'poster_path': '/qIm2nHXLpBBdMxi8dvfrnDkBUDh.jpg', 'backdrop_path': '/njFixYzIxX8jsn6KMSEtAzi4avi.jpg'}",150000000,"[{'id': 28, 'name': 'Action'}, {'id': 12, 'name': 'Adventure'}, {'id': 878, 'name': 'Science Fiction'}, {'id': 53, 'name': 'Thriller'}]",http://www.jurassicworld.com/,135397,tt0369610,en,Jurassic World,"Twenty-two years after the events of Jurassic Park, Isla Nublar now features a fully functioning dinosaur theme park, Jurassic World, as originally envisioned by John Hammond.",100.646,/rhr4y79GpxQF9IsfJItRXVaoGs4.jpg,"[{'id': 56, 'logo_path': '/cEaxANEisCqeEoRvODv2dO1I0iI.png', 'name': 'Amblin Entertainment', 'origin_country': 'US'}, {'id': 923, 'logo_path': '/5UQsZrfbfG2dYJbx8DxfoTr2Bvu.png', 'name': 'Legendary Pictures', 'origin_country': 'US'}, {'id': 33, 'logo_path': '/8lvHyhjr8oUKOOy2dKXoALWKdp0.png', 'name': 'Universal Pictures', 'origin_country': 'US'}, {'id': 1778, 'logo_path': '/69xm6sF3JxugGVjfZfm1YY6d7EE.png', 'name': 'DENTSU', 'origin_country': 'JP'}, {'id': 862, 'logo_path': '/udTjbqPmcTbfrihMuLtLcizDEM1.png', 'name': 'The Kennedy/Marshall Company', 'origin_country': 'US'}]","[{'iso_3166_1': 'US', 'name': 'United States of America'}]",2015-06-06,1671713208,124,"[{'english_name': 'English', 'iso_639_1': 'en', 'name': 'English'}]",Released,The park is open.,Jurassic World,False,6.7,17394
False,/1TUg5pO1VZ4B0Q1amk3OlXvlpXV.jpg,"{'id': 762512, 'name': 'The Lion King (Reboot) Collection', 'poster_path': '/dGpIRn4Nqi63JO1RlKxjcPbQSAw.jpg', 'backdrop_path': '/jIgM7YNVft0YGeXsqrh3oG5TWLx.jpg'}",260000000,"[{'id': 12, 'name': 'Adventure'}, {'id': 10751, 'name': 'Family'}, {'id': 16, 'name': 'Animation'}]",https://movies.disney.com/the-lion-king-2019,420818,tt6105098,en,The Lion King,"Simba idolizes his father, King Mufasa, and takes to heart his own royal destiny. But not everyone in the kingdom celebrates the new cub's arrival. Scar, Mufasa's brother—and former heir to the throne—has plans of his own. The battle for Pride Rock is ravaged with betrayal, tragedy and drama, ultimately resulting in Simba's exile. With help from a curious pair of newfound friends, Simba will have to figure out how to grow up and take back what is rightfully his.",107.381,/dzBtMocZuJbjLOXvrl4zGYigDzh.jpg,"[{'id': 2, 'logo_path': '/wdrCwmRnLFJhEoH8GSfymY85KHT.png', 'name': 'Walt Disney Pictures', 'origin_country': 'US'}, {'id': 7297, 'logo_path': '/l29JYQVZbTcjZXoz4CUYFpKRmM3.png', 'name': 'Fairview Entertainment', 'origin_country': 'US'}]","[{'iso_3166_1': 'US', 'name': 'United States of America'}]",2019-07-12,1667635327,118,"[{'english_name': 'English', 'iso_639_1': 'en', 'name': 'English'}]",Released,The King has Returned.,The Lion King,False,7.2,8056
False,/nNmJRkg8wWnRmzQDe2FwKbPIsJV.jpg,"{'id': 86311, 'name': 'The Avengers Collection', 'poster_path': '/yFSIUVTCvgYrpalUktulvk3Gi5Y.jpg', 'backdrop_path': '/zuW6fOiusv4X9nnW3paHGfXcSll.jpg'}",220000000,"[{'id': 878, 'name': 'Science Fiction'}, {'id': 28, 'name': 'Action'}, {'id': 12, 'name': 'Adventure'}]",http://marvel.com/avengers_movie/,24428,tt0848228,en,The Avengers,"When an unexpected enemy emerges and threatens global safety and security, Nick Fury, director of the international peacekeeping agency known as S.H.I.E.L.D., finds himself in need of a team to pull the world back from the brink of disaster. Spanning the globe, a daring recruitment effort begins!",257.179,/RYMX2wcKCBAr24UyPD7xwmjaTn.jpg,"[{'id': 420, 'logo_path': '/hUzeosd33nzE5MCNsZxCGEKTXaQ.png', 'name': 'Marvel Studios', 'origin_country': 'US'}]","[{'iso_3166_1': 'US', 'name': 'United States of America'}]",2012-04-25,1518815515,143,"[{'english_name': 'English', 'iso_639_1': 'en', 'name': 'English'}, {'english_name': 'Hindi', 'iso_639_1': 'hi', 'name': 'हिन्दी'}, {'english_name': 'Russian', 'iso_639_1': 'ru', 'name': 'Pусский'}]",Released,Some assembly required.,The Avengers,False,7.7,25754
False,/gyCHdpyPXmp7rqxE10nlImkzRo9.jpg,"{'id': 9485, 'name': 'The Fast and the Furious Collection', 'poster_path': '/oLOevFZn6shjcrwK8E5nk2wyCdd.jpg', 'backdrop_path': '/gC9BUFiROWtaMsluGYziZ6lR4OJ.jpg'}",190000000,"[{'id': 28, 'name': 'Action'}, {'id': 53, 'name': 'Thriller'}, {'id': 80, 'name': 'Crime'}, {'id': 12, 'name': 'Adventure'}]",http://www.furious7.com/,168259,tt2820852,en,Furious 7,Deckard Shaw seeks revenge against Dominic Toretto and his family for his comatose brother.,80.292,/wurKlC3VKUgcfsn0K51MJYEleS2.jpg,"[{'id': 87857, 'logo_path': None, 'name': 'Abu Dhabi Film Commission', 'origin_country': ''}, {'id': 33, 'logo_path': '/8lvHyhjr8oUKOOy2dKXoALWKdp0.png', 'name': 'Universal Pictures', 'origin_country': 'US'}, {'id': 40890, 'logo_path': None, 'name': 'China Film Co.', 'origin_country': 'CN'}, {'id': 333, 'logo_path': '/5xUJfzPZ8jWJUDzYtIeuPO4qPIa.png', 'name': 'Original Film', 'origin_country': 'US'}, {'id': 3341, 'logo_path': '/dTG5dXE1kU2mpmL9BNnraffckLU.png', 'name': 'Fuji Television Network', 'origin_country': 'JP'}, {'id': 86352, 'logo_path': None, 'name': 'Québec Production Services Tax Credit', 'origin_country': ''}, {'id': 87858, 'logo_path': None, 'name': 'Colorado Office of Film, Television & Media', 'origin_country': ''}, {'id': 1778, 'logo_path': '/69xm6sF3JxugGVjfZfm1YY6d7EE.png', 'name': 'DENTSU', 'origin_country': 'JP'}, {'id': 2531, 'logo_path': '/pC2iDCDCvV85vOBP7a5Ukxuc0Du.png', 'name': 'MRC', 'origin_country': 'US'}, {'id': 1225, 'logo_path': '/rIxhJMR7oK8b2fMakmTfRLY2TZv.png', 'name': 'One Race', 'origin_country': 'US'}]","[{'iso_3166_1': 'CA', 'name': 'Canada'}, {'iso_3166_1': 'CN', 'name': 'China'}, {'iso_3166_1': 'JP', 'name': 'Japan'}, {'iso_3166_1': 'AE', 'name': 'United Arab Emirates'}, {'iso_3166_1': 'US', 'name': 'United States of America'}]",2015-04-01,1515047671,137,"[{'english_name': 'Arabic', 'iso_639_1': 'ar', 'name': 'العربية'}, {'english_name': 'English', 'iso_639_1': 'en', 'name': 'English'}, {'english_name': 'Spanish', 'iso_639_1': 'es', 'name': 'Español'}, {'english_name': 'Thai', 'iso_639_1': 'th', 'name': 'ภาษาไทย'}]",Released,Vengeance Hits Home,Furious 7,False,7.3,8779
False,/xJWPZIYOEFIjZpBL7SVBGnzRYXp.jpg,"{'id': 386382, 'name': 'Frozen Collection', 'poster_path': '/dwdyvzFX9NEI7oFlRnZurRmlswQ.jpg', 'backdrop_path': '/6QonAoIN0jhWZZWZGJswSxHzUnU.jpg'}",150000000,"[{'id': 10751, 'name': 'Family'}, {'id': 16, 'name': 'Animation'}, {'id': 12, 'name': 'Adventure'}, {'id': 35, 'name': 'Comedy'}, {'id': 14, 'name': 'Fantasy'}]",https://movies.disney.com/frozen-2,330457,tt4520988,en,Frozen II,"Elsa, Anna, Kristoff and Olaf head far into the forest to learn the truth about an ancient mystery of their kingdom.",171.918,/mINJaa34MtknCYl5AjtNJzWj8cD.jpg,"[{'id': 2, 'logo_path': '/wdrCwmRnLFJhEoH8GSfymY85KHT.png', 'name': 'Walt Disney Pictures', 'origin_country': 'US'}, {'id': 6125, 'logo_path': '/tVPmo07IHhBs4HuilrcV0yujsZ9.png', 'name': 'Walt Disney Animation Studios', 'origin_country': 'US'}]","[{'iso_3166_1': 'US', 'name': 'United States of America'}]",2019-11-20,1450026933,103,"[{'english_name': 'English', 'iso_639_1': 'en', 'name': 'English'}]",Released,The past is not what it seems.,Frozen II,False,7.3,7785
False,/xnqust9Li4oxfhXD5kcPi3UC8i4.jpg,"{'id': 86311, 'name': 'The Avengers Collection', 'poster_path': '/yFSIUVTCvgYrpalUktulvk3Gi5Y.jpg', 'backdrop_path': '/zuW6fOiusv4X9nnW3paHGfXcSll.jpg'}",250000000,"[{'id': 28, 'name': 'Action'}, {'id': 12, 'name': 'Adventure'}, {'id': 878, 'name': 'Science Fiction'}]",http://marvel.com/movies/movie/193/avengers_age_of_ultron,99861,tt2395427,en,Avengers: Age of Ultron,"When Tony Stark tries to jumpstart a dormant peacekeeping program, things go awry and Earth’s Mightiest Heroes are put to the ultimate test as the fate of the planet hangs in the balance. As the villainous Ultron emerges, it is up to The Avengers to stop him from enacting his terrible plans, and soon uneasy alliances and unexpected action pave the way for an epic and unique global adventure.",151.399,/4ssDuvEDkSArWEdyBl2X5EHvYKU.jpg,"[{'id': 420, 'logo_path': '/hUzeosd33nzE5MCNsZxCGEKTXaQ.png', 'name': 'Marvel Studios', 'origin_country': 'US'}]","[{'iso_3166_1': 'US', 'name': 'United States of America'}]",2015-04-22,1405403694,141,"[{'english_name': 'English', 'iso_639_1': 'en', 'name': 'English'}]",Released,A New Age Has Come.,Avengers: Age of Ultron,False,7.3,18838
False,/AlFqBwJnokrp9zWTXOUv7uhkaeq.jpg,"{'id': 529892, 'name': 'Black Panther Collection', 'poster_path': '/uVnN6KnfDuHiC8rsVsSc7kk0WRD.jpg', 'backdrop_path': '/1Jj7Frjjbewb6Q6dl6YXhL3kuvL.jpg'}",200000000,"[{'id': 28, 'name': 'Action'}, {'id': 12, 'name': 'Adventure'}, {'id': 878, 'name': 'Science Fiction'}]",https://marvel.com/movies/movie/224/black_panther,284054,tt1825683,en,Black Panther,"King T'Challa returns home to the reclusive, technologically advanced African nation of Wakanda to serve as his country's new leader. However, T'Challa soon finds that he is challenged for the throne by factions within his own country as well as without. Using powers reserved to Wakandan kings, T'Challa assumes the Black Panther mantle to join with ex-girlfriend Nakia, the queen-mother, his princess-kid sister, members of the Dora Milaje (the Wakandan 'special forces') and an American secret agent, to prevent Wakanda from being dragged into a world war.",101.146,/uxzzxijgPIY7slzFvMotPv8wjKA.jpg,"[{'id': 420, 'logo_path': '/hUzeosd33nzE5MCNsZxCGEKTXaQ.png', 'name': 'Marvel Studios', 'origin_country': 'US'}]","[{'iso_3166_1': 'US', 'name': 'United States of America'}]",2018-02-13,1346739107,134,"[{'english_name': 'English', 'iso_639_1': 'en', 'name': 'English'}, {'english_name': 'Korean', 'iso_639_1': 'ko', 'name': '한국어/조선말'}, {'english_name': 'Swahili', 'iso_639_1': 'sw', 'name': 'Kiswahili'}, {'english_name': 'Xhosa', 'iso_639_1': 'xh', 'name': ''}]",Released,Long live the king.,Black Panther,False,7.4,18212
False,/n5A7brJCjejceZmHyujwUTVgQNC.jpg,"{'id': 1241, 'name': 'Harry Potter Collection', 'poster_path': '/eVPs2Y0LyvTLZn6AP5Z6O2rtiGB.jpg', 'backdrop_path': '/wfnMt6LGqYHcNyOfsuusw5lX3bL.jpg'}",125000000,"[{'id': 14, 'name': 'Fantasy'}, {'id': 12, 'name': 'Adventure'}]",https://www.warnerbros.com/movies/harry-potter-and-deathly-hallows-part-2/,12445,tt1201607,en,Harry Potter and the Deathly Hallows: Part 2,"Harry, Ron and Hermione continue their quest to vanquish the evil Voldemort once and for all. Just as things begin to look hopeless for the young wizards, Harry discovers a trio of magical objects that endow him with powers to rival Voldemort's formidable skills.",213.557,/da22ZBmrDOXOCDRvr8Gic8ldhv4.jpg,"[{'id': 174, 'logo_path': '/IuAlhI9eVC9Z8UQWOIDdWRKSEJ.png', 'name': 'Warner Bros. Pictures', 'origin_country': 'US'}, {'id': 437, 'logo_path': '/nu20mtwbEIhUNnQ5NXVhHsNknZj.png', 'name': 'Heyday Films', 'origin_country': 'GB'}]","[{'iso_3166_1': 'GB', 'name': 'United Kingdom'}, {'iso_3166_1': 'US', 'name': 'United States of America'}]",2011-07-07,1341511219,130,"[{'english_name': 'English', 'iso_639_1': 'en', 'name': 'English'}]",Released,It all ends here.,Harry Potter and the Deathly Hallows: Part 2,False,8.1,16456
False,/epVMXf10WqFkONzKR8V76Ypj5Y3.jpg,"{'id': 10, 'name': 'Star Wars Collection', 'poster_path': '/tdQzRSk4PXX6hzjLcQWHafYtZTI.jpg', 'backdrop_path': '/d8duYyyC9J5T825Hg7grmaabfxQ.jpg'}",200000000,"[{'id': 878, 'name': 'Science Fiction'}, {'id': 28, 'name': 'Action'}, {'id': 12, 'name': 'Adventure'}]",https://www.starwars.com/films/star-wars-episode-viii-the-last-jedi,181808,tt2527336,en,Star Wars: The Last Jedi,"Rey develops her newly discovered abilities with the guidance of Luke Skywalker, who is unsettled by the strength of her powers. Meanwhile, the Resistance prepares to do battle with the First Order.",52.179,/kOVEVeg59E0wsnXmF9nrh6OmWII.jpg,"[{'id': 1, 'logo_path': '/o86DbpburjxrqAzEDhXZcyE8pDb.png', 'name': 'Lucasfilm Ltd.', 'origin_country': 'US'}]","[{'iso_3166_1': 'US', 'name': 'United States of America'}]",2017-12-13,1332539889,152,"[{'english_name': 'English', 'iso_639_1': 'en', 'name': 'English'}]",Released,Darkness rises... and light to meet it,Star Wars: The Last Jedi,False,6.9,12441
False,/3s9O5af2xWKWR5JzP2iJZpZeQQg.jpg,"{'id': 328, 'name': 'Jurassic Park Collection', 'poster_path': '/qIm2nHXLpBBdMxi8dvfrnDkBUDh.jpg', 'backdrop_path': '/njFixYzIxX8jsn6KMSEtAzi4avi.jpg'}",170000000,"[{'id': 28, 'name': 'Action'}, {'id': 12, 'name': 'Adventure'}, {'id': 878, 'name': 'Science Fiction'}]",http://www.jurassicworld.com,351286,tt4881806,en,Jurassic World: Fallen Kingdom,"Three years after the demise of Jurassic World, a volcanic eruption threatens the remaining dinosaurs on Isla Nublar. So, Claire Dearing recruits Owen Grady to help prevent the extinction of the dinosaurs once again.",89.095,/7dAh80ydoWvUaBE8uFYkp9WsoSC.jpg,"[{'id': 56, 'logo_path': '/cEaxANEisCqeEoRvODv2dO1I0iI.png', 'name': 'Amblin Entertainment', 'origin_country': 'US'}, {'id': 923, 'logo_path': '/5UQsZrfbfG2dYJbx8DxfoTr2Bvu.png', 'name': 'Legendary Pictures', 'origin_country': 'US'}, {'id': 33, 'logo_path': '/8lvHyhjr8oUKOOy2dKXoALWKdp0.png', 'name': 'Universal Pictures', 'origin_country': 'US'}, {'id': 10338, 'logo_path': '/el2ap6lvjcEDdbyJoB3oKiYgXu9.png', 'name': 'Perfect World Pictures', 'origin_country': 'CN'}]","[{'iso_3166_1': 'US', 'name': 'United States of America'}]",2018-06-06,1303459585,129,"[{'english_name': 'English', 'iso_639_1': 'en', 'name': 'English'}, {'english_name': 'Russian', 'iso_639_1': 'ru', 'name': 'Pусский'}]",Released,The park is gone,Jurassic World: Fallen Kingdom,False,6.6,9358
False,/9WHM084AoskcHCObAy4QnJg01eM.jpg,"{'id': 386382, 'name': 'Frozen Collection', 'poster_path': '/dwdyvzFX9NEI7oFlRnZurRmlswQ.jpg', 'backdrop_path': '/6QonAoIN0jhWZZWZGJswSxHzUnU.jpg'}",150000000,"[{'id': 16, 'name': 'Animation'}, {'id': 12, 'name': 'Adventure'}, {'id': 10751, 'name': 'Family'}]",http://movies.disney.com/frozen,109445,tt2294629,en,Frozen,"Young princess Anna of Arendelle dreams about finding true love at her sister Elsa’s coronation. Fate takes her on a dangerous journey in an attempt to end the eternal winter that has fallen over the kingdom. She's accompanied by ice delivery man Kristoff, his reindeer Sven, and snowman Olaf. On an adventure where she will find out what friendship, courage, family, and true love really means.",151.145,/kgwjIb2JDHRhNk13lmSxiClFjVk.jpg,"[{'id': 2, 'logo_path': '/wdrCwmRnLFJhEoH8GSfymY85KHT.png', 'name': 'Walt Disney Pictures', 'origin_country': 'US'}, {'id': 6125, 'logo_path': '/tVPmo07IHhBs4HuilrcV0yujsZ9.png', 'name': 'Walt Disney Animation Studios', 'origin_country': 'US'}]","[{'iso_3166_1': 'US', 'name': 'United States of America'}]",2013-11-20,1274219009,102,"[{'english_name': 'English', 'iso_639_1': 'en', 'name': 'English'}]",Released,Only the act of true love will thaw a frozen heart.,Frozen,False,7.3,13694
False,/m3tdSyl11fhgXPDSEt3aBctTqGP.jpg,,160000000,"[{'id': 10751, 'name': 'Family'}, {'id': 14, 'name': 'Fantasy'}, {'id': 10749, 'name': 'Romance'}]",http://movies.disney.com/beauty-and-the-beast-2017,321612,tt2771200,en,Beauty and the Beast,A live-action adaptation of Disney's version of the classic tale of a cursed prince and a beautiful young woman who helps him break the spell.,58.1,/tWqifoYuwLETmmasnGHO7xBjEtt.jpg,"[{'id': 2, 'logo_path': '/wdrCwmRnLFJhEoH8GSfymY85KHT.png', 'name': 'Walt Disney Pictures', 'origin_country': 'US'}, {'id': 10227, 'logo_path': '/3YfRy3DBl4abcqkzGx4RVNz12yl.png', 'name': 'Mandeville Films', 'origin_country': 'US'}]","[{'iso_3166_1': 'US', 'name': 'United States of America'}]",2017-03-16,1263521126,129,"[{'english_name': 'French', 'iso_639_1': 'fr', 'name': 'Français'}, {'english_name': 'English', 'iso_639_1': 'en', 'name': 'English'}]",Released,Be our guest.,Beauty and the Beast,False,7.0,13773
False,/mabuNsGJgRuCTuGqjFkWe1xdu19.jpg,"{'id': 468222, 'name': 'The Incredibles Collection', 'poster_path': '/xMX1jZyObVeWUxDQmt53X6jzIO4.jpg', 'backdrop_path': '/6oi6V1O9MJRNnfV8E9JMntmFqBD.jpg'}",200000000,"[{'id': 28, 'name': 'Action'}, {'id': 12, 'name': 'Adventure'}, {'id': 16, 'name': 'Animation'}, {'id': 10751, 'name': 'Family'}]",https://movies.disney.com/incredibles-2,260513,tt3606756,en,Incredibles 2,"Elastigirl springs into action to save the day, while Mr. Incredible faces his greatest challenge yet – taking care of the problems of his three children.",96.122,/9lFKBtaVIhP7E2Pk0IY1CwTKTMZ.jpg,"[{'id': 2, 'logo_path': '/wdrCwmRnLFJhEoH8GSfymY85KHT.png', 'name': 'Walt Disney Pictures', 'origin_country': 'US'}, {'id': 3, 'logo_path': '/1TjvGVDMYsj6JBxOAkUHpPEwLf7.png', 'name': 'Pixar', 'origin_country': 'US'}]","[{'iso_3166_1': 'US', 'name': 'United States of America'}]",2018-06-14,1242805359,118,"[{'english_name': 'English', 'iso_639_1': 'en', 'name': 'English'}]",Released,Back to work.,Incredibles 2,False,7.5,10443
False,/jzdnhRhG0dsuYorwvSqPqqnM1cV.jpg,"{'id': 9485, 'name': 'The Fast and the Furious Collection', 'poster_path': '/oLOevFZn6shjcrwK8E5nk2wyCdd.jpg', 'backdrop_path': '/gC9BUFiROWtaMsluGYziZ6lR4OJ.jpg'}",250000000,"[{'id': 28, 'name': 'Action'}, {'id': 80, 'name': 'Crime'}, {'id': 53, 'name': 'Thriller'}]",http://www.fastandfurious.com/,337339,tt4630562,en,The Fate of the Furious,"When a mysterious woman seduces Dom into the world of crime and a betrayal of those closest to him, the crew face trials that will test them as never before.",82.348,/dImWM7GJqryWJO9LHa3XQ8DD5NH.jpg,"[{'id': 33, 'logo_path': '/8lvHyhjr8oUKOOy2dKXoALWKdp0.png', 'name': 'Universal Pictures', 'origin_country': 'US'}, {'id': 333, 'logo_path': '/5xUJfzPZ8jWJUDzYtIeuPO4qPIa.png', 'name': 'Original Film', 'origin_country': 'US'}, {'id': 7958, 'logo_path': None, 'name': 'Fuji Eight Company Ltd.', 'origin_country': ''}, {'id': 40890, 'logo_path': None, 'name': 'China Film Co.', 'origin_country': 'CN'}, {'id': 1778, 'logo_path': '/69xm6sF3JxugGVjfZfm1YY6d7EE.png', 'name': 'DENTSU', 'origin_country': 'JP'}, {'id': 1225, 'logo_path': '/rIxhJMR7oK8b2fMakmTfRLY2TZv.png', 'name': 'One Race', 'origin_country': 'US'}]","[{'iso_3166_1': 'US', 'name': 'United States of America'}]",2017-04-12,1238764765,136,"[{'english_name': 'English', 'iso_639_1': 'en', 'name': 'English'}, {'english_name': 'Spanish', 'iso_639_1': 'es', 'name': 'Español'}]",Released,Family no more.,The Fate of the Furious,False,6.9,8623
